{
  "schema_version": "0.4.0",
  "id": "55555555-5555-4555-8555-555555555555",
  "project_id": "11111111-1111-4111-8111-111111111111",
  "created_at": "2026-08-18T02:08:00Z",
  "created_by": "主编",
  "scene_id": "33333333-3333-4333-8333-333333333333",
  "status": "InReference",
  "intent": "林晚在河滩发现并拾起残玉，不解释来历。",
  "beats": [
    { "order": 1, "description": "先冷" },
    { "order": 2, "description": "后见光" },
    { "order": 3, "description": "再拾玉" }
  ]
}
